{
  "$schema": "https://json-schema.org/draft/2020-12/schema",
  "$id": "https://trippilot.local/contracts/agent-resume-command-v1.schema.json",
  "title": "Agent Resume Command v1",
  "type": "object",
  "additionalProperties": false,
  "required": [
    "eventType",
    "schemaVersion",
    "eventId",
    "traceId",
    "tripId",
    "runId",
    "occurredAt",
    "payload"
  ],
  "properties": {
    "eventType": {"const": "AGENT_RESUME"},
    "schemaVersion": {"const": 1},
    "eventId": {"type": "string", "format": "uuid"},
    "traceId": {"type": "string", "format": "uuid"},
    "tripId": {"type": "string", "format": "uuid"},
    "runId": {"type": "string", "format": "uuid"},
    "occurredAt": {"type": "string", "format": "date-time"},
    "payload": {"$ref": "#/$defs/payload"}
  },
  "$defs": {
    "answer": {
      "type": "string",
      "minLength": 1,
      "maxLength": 2000,
      "pattern": "\\S"
    },
    "payload": {
      "type": "object",
      "additionalProperties": false,
      "required": ["answer"],
      "properties": {
        "answer": {"$ref": "#/$defs/answer"}
      }
    }
  }
}
